{
  "bundle_id": "scb-qc-release-v0.1",
  "schema_version": "v0",
  "claim_artifact": {
    "artifact_id": "claim-qc-release-v0.1",
    "artifact_type": "ClaimArtifact.v0",
    "schema_version": "v0",
    "claim_text": "The qc-release simulation run satisfies the hospital lab QC release temporal policy under stated assumptions.",
    "claim_kind": "temporal_claim",
    "status": "CertificateChecked",
    "assumption_set_ref": "as-labtrust-qc-v0.1",
    "source_span_refs": ["span-qc-release-spec-1"],
    "formal_statement": "G (release_ready -> F[0,24h] verified)",
    "certificate_refs": ["cert-trace-qc-release-v0.1"],
    "runtime_receipt_refs": ["receipt-qc-release-run-001"],
    "created_at": "2026-05-16T12:05:00Z",
    "producer": "labtrust-gym",
    "producer_version": "0.1.0",
    "source_repo": "https://github.com/fraware/LabTrust-Gym",
    "source_commit": "aaaaaaaaaaaaaaaaaaaaaaaaaaaaaaaaaaaaaaaa",
    "signature_or_digest": "sha256:2222222222222222222222222222222222222222222222222222222222222222"
  },
  "assumption_set": {
    "assumption_set_id": "as-labtrust-qc-v0.1",
    "schema_version": "v0",
    "created_at": "2026-05-16T12:00:00Z",
    "producer": "labtrust-gym",
    "producer_version": "0.1.0",
    "source_repo": "https://github.com/fraware/LabTrust-Gym",
    "source_commit": "aaaaaaaaaaaaaaaaaaaaaaaaaaaaaaaaaaaaaaaa",
    "assumptions": [
      {
        "assumption_id": "asm-domain-qc-sim",
        "text": "Simulation models a hospital QC release workflow, not a live clinical laboratory.",
        "kind": "domain",
        "status": "HumanReviewed",
        "source_span_refs": ["span-qc-release-spec-1"]
      },
      {
        "assumption_id": "asm-policy-trace-integrity",
        "text": "Exported trace.json is byte-stable for the run identifier.",
        "kind": "policy",
        "status": "RuntimeObserved",
        "source_span_refs": ["span-qc-release-spec-1"]
      }
    ],
    "human_review_status": "approved",
    "status": "HumanReviewed",
    "signature_or_digest": "sha256:1111111111111111111111111111111111111111111111111111111111111111"
  },
  "runtime_receipts": [
    {
      "receipt_id": "receipt-qc-release-run-001",
      "schema_version": "v0",
      "run_id": "runs/qc-release",
      "environment": {
        "platform": "linux",
        "python": "3.12",
        "labtrust_version": "0.1.0"
      },
      "started_at": "2026-05-16T11:58:00Z",
      "ended_at": "2026-05-16T12:00:00Z",
      "status": "RuntimeObserved",
      "events_hash": "sha256:3333333333333333333333333333333333333333333333333333333333333333",
      "policy_hash": "sha256:4444444444444444444444444444444444444444444444444444444444444444",
      "trace_hash": "sha256:5555555555555555555555555555555555555555555555555555555555555555",
      "producer": "labtrust-gym",
      "producer_version": "0.1.0",
      "source_repo": "https://github.com/fraware/LabTrust-Gym",
      "source_commit": "aaaaaaaaaaaaaaaaaaaaaaaaaaaaaaaaaaaaaaaa",
      "input_hashes": {
        "spec": "sha256:6666666666666666666666666666666666666666666666666666666666666666"
      },
      "output_hashes": {
        "trace.json": "sha256:5555555555555555555555555555555555555555555555555555555555555555"
      },
      "signature_or_digest": "sha256:7777777777777777777777777777777777777777777777777777777777777777"
    }
  ],
  "certificates": [
    {
      "certificate_id": "cert-trace-qc-release-v0.1",
      "schema_version": "v0",
      "trace_hash": "sha256:5555555555555555555555555555555555555555555555555555555555555555",
      "spec_hash": "sha256:6666666666666666666666666666666666666666666666666666666666666666",
      "property_id": "qc_release.temporal.safety",
      "checker": "certifyedge",
      "checker_version": "0.1.0",
      "status": "CertificateChecked",
      "counterexample_ref": null,
      "created_at": "2026-05-16T12:10:00Z",
      "producer": "certifyedge",
      "producer_version": "0.1.0",
      "source_repo": "https://github.com/fraware/CertifyEdge",
      "source_commit": "bbbbbbbbbbbbbbbbbbbbbbbbbbbbbbbbbbbbbbbb",
      "signature_or_digest": "sha256:8888888888888888888888888888888888888888888888888888888888888888"
    }
  ],
  "evidence_bundle": {
    "bundle_id": "evidence-qc-release-v0.1",
    "schema_version": "v0",
    "claim_refs": ["claim-qc-release-v0.1"],
    "assumption_set_refs": ["as-labtrust-qc-v0.1"],
    "runtime_receipt_refs": ["receipt-qc-release-run-001"],
    "certificate_refs": ["cert-trace-qc-release-v0.1"],
    "artifact_hashes": {
      "claim-qc-release-v0.1": "sha256:2222222222222222222222222222222222222222222222222222222222222222",
      "receipt-qc-release-run-001": "sha256:7777777777777777777777777777777777777777777777777777777777777777",
      "cert-trace-qc-release-v0.1": "sha256:8888888888888888888888888888888888888888888888888888888888888888"
    },
    "created_at": "2026-05-16T12:12:00Z",
    "producer": "labtrust-gym",
    "producer_version": "0.1.0",
    "source_repo": "https://github.com/fraware/LabTrust-Gym",
    "source_commit": "aaaaaaaaaaaaaaaaaaaaaaaaaaaaaaaaaaaaaaaa",
    "signature_or_digest": "sha256:9999999999999999999999999999999999999999999999999999999999999999"
  },
  "verification_policy": {
    "policy_id": "labtrust-v0.1-qc-release",
    "required_checks": ["schema-valid", "trace-hash-alignment", "assumption-set-present"]
  },
  "created_at": "2026-05-16T12:15:00Z",
  "producer": "labtrust-gym",
  "producer_version": "0.1.0",
  "source_repo": "https://github.com/fraware/LabTrust-Gym",
  "source_commit": "aaaaaaaaaaaaaaaaaaaaaaaaaaaaaaaaaaaaaaaa",
  "signature_or_digest": "sha256:bbbbbbbbbbbbbbbbbbbbbbbbbbbbbbbbbbbbbbbbbbbbbbbbbbbbbbbbbbbbbbbb"
}
